Категория,Вопросы,Ответ,Квартал
Event,"Очень мне кажется вышло некорректно со стороны Команды, ответственной за летний тимбилдинг менять дату. Еще в начале года были утверждены другие даты, все уже все распланировали, а по факту теперь людям нужно либо отказываться от отпуска, или отказываться от тимбилдинга, потому что билеты уже куплены и никто не вернет за них деньги. Многие купили путевки на эти даты, потому что ориентировались на утвержденные даты (которые между прочим официально были всем скинуты). Как то неправильно все это и несправедливо ","К сожалению, перенести дату тимбилдинга не получилось мы сдвинули ее, так как гольф-клуб был свободен только 25 числа и позже",Q3 2025
Event,"Очень жаль, что перенесли дату проведения Nomad Fest. Заранее строили планы, ориентируясь на ранее объявленую дату — 18 июля, и теперь, к сожалению, не смогу принять участие в одном из самых ожидаемых событий компании.","К сожалению, перенести дату тимбилдинга не получилось мы сдвинули ее, так как гольф-клуб был свободен только 25 числа и позже",Q3 2025
Event,Почему перенесли дату летнего тимбилдинга с 18го на 25ое? 😢Можно ли перенести ее обратно?,"К сожалению, перенести дату тимбилдинга не получилось мы сдвинули ее, так как гольф-клуб был свободен только 25 числа и позже",Q3 2025
АХО,"Холодно в кабинетах, из-за этого многие сотрудники заболевают. Прошу сделать температуру в кабинетах комфортной, это очень мешает спокойно работать😭 сама болею уже 3 раз за сезон",Неактуален вопрос,Q3 2025
АХО,"Очень холодно в офисе, можно как-то решить вопрос с отоплением. ",Неактуален вопрос,Q3 2025
Даурен ,давайте поменяем цвета салфеток на красные,не будем,Q3 2025
Даурен ,"предлагаю нанять швейцара, устал каждый раз дверь открывать",не будем,Q3 2025
АХО,"Даурен, здравствуйте!
Вклад нашей команды в развитие компании, как Вы знаете, требует оперативного решения вопросов. Для этого многие сотрудники активно используют личные ноутбуки. Предлагаю вновь рассмотреть возможность компенсации за использование личного оборудования, что позволит нам поддерживать высокий темп работы и эффективнее способствовать развитию компании.
Также, для повышения мотивации и восстановления сил, прошу рассмотреть возможность выплаты небольшой суммы на отпускные расходы. Опыт других успешных организаций показывает, что такая мера положительно влияет на продуктивность и лояльность сотрудников.",с 1 сентября будет,Q3 2025
Битрикс,"Здравствуйте!

Уже много лет одна проблема - в битриксе не обновляют фото и должности.","Исправим это, автоматизируем",Q3 2025
Даурен ,"Теряете действительно хороших и полезных людей для бизнеса из-за пары человек из топ менеджмента, который окружает вас. Никакой компетентности, никаких ценностей",нет точности в вопросе,Q3 2025
Даурен ,Здравствуйте! Как у вас дела? Получается летом так же придерживаться режима 22:00 сон и подъем в 5 утра? ,К сожалению нет,Q3 2025
АХО,"Здравствуйте, Даурен! 
Спасибо за все плюшки, которые есть в компании. Очень радует возможность учить английский язык на работе (прям топ, не везде такое есть. Был на другом, но уровень преподавания тут намного выше. Отличный набор). Но, недавно на 11 этаже кабинет поменяли и стало неудобно заниматься, т.к. комната маленькая, там с трудом помещается 5 человек и совсем не развернуться, плюс быстро становится душно. И шум сверху мешает уловить процесс.  Можно ли вернуть старый кабинет на 11/10 или рассмотреть другой , потому что английский учить хочется, но сейчас это неудобно. Спасибо!",Пока нет других кабинетов,Q3 2025
АХО,"Кабинет английского языка на 11 этаже маленький, 6 человек нормально не помещаются.",Пока нет других кабинетов,Q3 2025
Даурен ,"Пользуясь случаем, хочу во всеуслышание поблагодарить наших преподавателей английского языка и в частности Аяну за прекрасно организованные, веселые мероприятия и за классные, структурированные, полезные уроки. Ловлю себя на мысли, что кукуха, возможно, еще не улетела только благодаря урокам с Аяной. Thank you so much, our dear teacher!","Спасибо, Аяна!) ",Q3 2025
Event ,"Я уже говорил об этом, но хочу просто напомнить чтобы на летнем тимбилдинге было побольше водяных пистолетов) Всем пис","Водных пистолетов было больше, чем в прошлом году,  при желании можно взять свои",Q3 2025
Даурен ,Что нужно делать на работе или сделать для работы чтоб получилось взять собственную квартиру.,"Повышать эффективность, развивать таланты, откладывать",Q3 2025
Event ,"В холдинге очень много различных мероприятий проходят и за это отдельная благодарность. Вопрос, есть ли мероприятия, куда можно было бы приходить с супругой? Поднимался ли до этого этот вопрос? А то супруги завидуют своим                  мужьям/женам - сотрудникам холдинга, но сами не имеют возможности поучаствовать. В целях укрепления семьи, было бы очень на пользу! )))","Нет, все активности для сотрудников",Q3 2025
Даурен ,"Почему сотрудники некоторых компаний должны делать работу за другие компании? Двойная, а то и тройная работа за зарплату одного специалиста
Могу понять, если в компании не хватает рабочих рук, но будто бы это уже перебор","Согласен, но кто это делает, не непонятно. Напишите",Q3 2025
АХО,"Здравствуйте!
Хотела бы поделиться обратной связью по поводу условий в туалетах.

К сожалению, текущая ситуация оставляет желать лучшего:
– помещение совершенно не изолировано, слышимость очень высокая;
– запах быстро распространяется по всему пространству, возможно, вытяжка работает неэффективно или вовсе отсутствует;
– отсутствует ощущение уединения и базового комфорта.

Также хотела бы попросить на будущее при организации тимбилдингов учитывать вопрос санитарных условий с канализацией — биотуалеты без канализации создают значительный дискомфорт. Считаю что это не соответствует имиджу IT холдинга, коим мы себя позиционируем.

На предыдущих местах работы с этим никогда не было проблем, потому что это всё же базовый минимум, а не роскошный максимум. 

Буду признательна, если этот вопрос получится решить. Спасибо!",Из-за формата мероприятия на открытом воздухе подключение к канализации невозможно.,Q3 2025
Даурен,"никто не любит нотации, но иногда без них никак. Это не жалоба, а скорее просьба от тех, кто тоже живёт рядом с вами и хочет, чтобы общее пространство было комфортным для всех.
на 9 этаже вижу неприятные моменты:
– В женском туалете часто стоит неприятный запах (ощущение что никто не знает про освежитель воздуха), бумага почему-то не попадает в урну и оказывается где угодно.
– Мокрые полы вокруг раковины как будто кто-то умывался с душем в руках.
– На кухне бывает, что продукты (например, мёд/молоко) проливаются на стол, но никто за собой не вытирает. Уже молчу про то, что молоко должно храниться в холодильнике,
Понимаем, бывают спешка, усталость, невнимательность. Но всё же давайте уважать друг друга. Мы все взрослые, адекватные люди, живём в одном пространстве и хотим чувствовать себя в нём комфортно. Ведь от таких мелочей зависит общее настроение.","В туалетах стараемся сделать комфортные условия. еще раз поднимем этот вопрос. Но, также нужно убирать за собой",Q3 2025
АХО,"Добрый день всем! Очень рада работать в BFE🫶🏻 Коллеги классные, работа нравится, плюшки нравятся, но жара в кабинетах изматывает, не один день лета нормально эти кондеры не работали, в коридорах хорошо, но в кабинетах жараааа, возвращаешься домой обессиленным, потным и измотанным… ",Берем в работу,Q3 2025
АХО,"Добрый, душный день
Даурен, помогите решить вопрос с кондиционерами на солнечной стороне. За окном 35 градусов. Каждый раз вызываем администрацию БЦ, они приходят, просто тыкают этот пульт у стены. И молча уходят. Уже второе лето в этом крыле невозможно работать, это влияет на работоспособность. Болит голова от нехватки воздуха ко второй половине дня. Сидишь как в сауне. ",Берем в работу,Q3 2025
Event ,"Есть идея создать что то музыкальное, мейби собрать бэнд или хор, потому что у нас есть все спортивное, но если бы была бы возможность устроить что то пассивное, для души:)  какой то музыкальный кабинет, разбавить обстановку творческой-музыкальной ноткой💐",Подумаем,Q3 2025
Даурен ,"Здравствуйте! Спасибо за спанч боб и возможность быть услышанным. Подскажите, пожалуйста, как сохранять эффективность в работе если за последние 6 месяцев у команды сменилось 5 руководителей и грядет 3 переезд в другой кабинет? В компании действительно делается много плюшек для сотрудников, это правда очень ценно, спасибо. Но возможно, не так важны завтраки, как возможность работать в здоровой и психологически комфортной среде","Нужно смотреть, что конкретно напрягает. Относиться с позитивом. Придет тот, что возглавит и залидит, немного надо потерпеть",Q3 2025
Даурен ,"Здравствуйте! Хотелось бы уточнить настолько ли важно, чтобы у каждого директора был отдельный кабинет, особенно сейчас - когда для других сотрудников не хватает места, и все вынуждены переезжать по несколько раз? В целом учитывается ли насколько быстро растут команды (есть ли ресурсные карты), чтобы качественно подойти к планированию места в офисе?","Кабинеты для директоров важны, так как много совещаний. ",Q3 2025
Даурен ,"Здравствуйте!
Вопрос с переездами в 7G уже очень утомил, никакого процесса, сначала всё все перетаскивают потом думают как поставить и снова всё переставляют, нет никакой организации из-за чего страдают рабочие процессы. Переезд порой затягивается на пару дней..не говоря уже о том что размеры кабинетов не соответствуют количеству человек в командах, которые в них сидят
Складывается впечатление, что внешним бонусам и плюшкам отдается больше приоритетов, чем организации рабочего пространства и рабочего графика, что на мой взгляд все таки первичнее ","Уделяем достаточно времени, что бы создать все комфортные условия. Это лучший офис, который когда-либо был у компании",Q3 2025
Даурен ,"Добрый день!
Офис менеджер 11 этажа, вы самая лучшая!! Рахмет за поддержку. ",Спасибо,Q3 2025
АХО,"Если есть возможность, разделить намазхану на жен и муж. Все читают намаз в обеденный перерыв и часто не успеваем прочитать в перерыве из за очереди.  Плюс было бы классно туда добавить кондер","Есть решение, будет разделение.",Q3 2025
Даурен ,"HR - корп культура:

- Нужно усиление HR команды. Сотрудники неверно понимают фразу ""Главное люди"". Либо нужно изменить эту ценность типа ""принимая - отдавай"". Сейчас работает только ""принимай""

- Есть определенные ""старички"" в сговоре, которые проявляют токсичность. Все вместе могут топить, обесценивать тех, кто пытается что то делать. Сговор очень сильно ощущается, потому что одни и те же люди в моменте могут проявлять активность для публичного обесценивания - в одим и тот же час, например. И тот кто пытается что то сделать, выгорает. Возможно это для этого и делается, чтобы тот человек, который что то делает - выгорел и ушел, чтобы потом можно было жить как раньше. Как в школе, когда приходит новый учитель, его в начале пытаются подстроить под свои правила. Если не вышло - довести, чтобы ушел. 
Обычно в корп культуру закладывается вариант, что сразу сделать идеально невозможно. Делается версия 1.0, потом улучшается до версии 2.0 итд.  У нас же в версии 1.0 ""бьют по рукам"", идут все дружно обесценивать, говорить не выйдет, не получится решить, зачем надо было делать так, вы не компетентны  итд. Потом тому кто пытается что то изменить, страшно делать версию 2.0

- старички могут прямо или косвенно просить не обращаться, не дергать, потому что ""я исполнитель"". Типа подойдете как сделаете. Но как сделается, дают комментарий, что надо было по другому, что они знают как лучше, то есть нужен идеальный вариант, но я не дам вводные данные - догадайся сам

Итог: токсичность заразна и быстро распространяется. Нужен HR, который исключит источник токсичности. Мне источник неизвестен ","У нас ожидается объединение всех HR. Во главе будет человек, который надеюсь сможет решить эти вопросы и будет эффективно в работе. Нужна конкретика по ситуации токсичности",Q3 2025
Битркис,"в пропипл не хватает разработчиков. Сейчас все начали активно внедрять СРМ, задач много. 2 разработчика это очень мало. Плюс в пропипл нужен тестировщик, который перед тем как закрыть задачу, протестирует исполнение. Часто задачи закрываются разработчиком, а там внутри есть много ошибок и недоработок ",Возьмем в работу,Q3 2025
Event ,провести соревенование по подтягиваниям на турнике,Проведем,Q3 2025
Даурен,"Рассмотреть вариант добавления ""новой плюшки"": чтобы у сотрудника было 4-6 оплачиваемых дней в году, в которые он мог бы взять выходной чтобы решить неотложные дела по дому, хозяйству, банкам и прочее",Не будет,Q3 2025
АХО,Можно ли на парковке для самокатов на улице установить козырёк и возможно ли как-то установить розетки для того чтобы можно было зарядить самокат? ,Есть козырек,Q3 2025
Даурен,"Здравствуйте!
Мы быстроразвивающаяся компания и это круто, но часто в работе появляются ситуации мискоммуникации. Например, когда открывается один функциональный департамент со своими задачами, затем его переформировывают и дают новые задачи. А старые задачи никому никак не передаются, и часто просто довеском скидываются на других сотрудников (с близким функционалом) по умолчанию, что приводит к перегрузке и переработкам сотрудников, которые изначально не имели никакого отношения к этим задачам. Можно ли регламентировать процессы передачи дел компании с назначением ответственных лиц, с согласием всех задействованных лиц, чтобы подобные ситуации не фрустрировали и не нарушали рабочих процессов?
Спасибо за возможность задавать вам вопросы, надеюсь на улучшение по данному вопросу",Возьмем в работу,Q3 2025
АХО,"Можно ремонтировать-сверлить только в не рабочее время, очень отвлекает. Спасибо","Переговорим (но так как это ремонт на 7-8 этиажа, мы ничего не сможем сделать). Надо потерпеть",Q3 2025
АХО,"Можно ли как-нибудь приостанавливать ремонтные работы в других этажах в рабочее время? Максимально некомфортно работать когда звук дрели над головой, вроде бы офис предназначен для спокойной и продуктивной работы((","Переговорим (но так как это ремонт на 7-8 этиажа, мы ничего не сможем сделать). Надо потерпеть",Q3 2025
Даурен,Какие топ-3 изменения будут до конца этого года в компании? ,"1. Поменяется орг структура 
2. Micrososft корпоративный 
3. Придет Президент",Q3 2025
АХО,"Что думаете по поводу одноразовых приборов на кухне? Думаю, было бы удобно","не целесообразно, много пластика",Q3 2025
