Категория,Вопросы,Ответ,Квартал
АХО,"Здравствуйте! Можно ли что-то сделать со столешницей у раковин в уборных? На них всегда скапливается вода и во время мытья рук пачкается одежда. Возможно, изначально установили не ровно и поэтому такая проблема возникла.","Давайте чекним, я не готов пока ответить, на 9 этаже все ок",Q3 2024
АХО,"Добрый день! Можно ли сделать какие-либо дверцы в слотах коридора, где можно сидеть и работать самостоятельно? Небольшие, как непрозрачные ставни для окон, которые могут закрыть сантиметров 50, чтобы все равно можно было видеть, что человек работает или его очертания. Просто это невозможно, постоянно все проходят, отвлекаешься, невозможно оградиться от внешнего мира и сконцентрироваться на работе. Рядом люди работают с проводами в потолке, люди просто проходят или даже стоят и разговаривают рядом группами, буквально в 10 см от тебя, или рядом туалет и все ходят туда-сюда, по понятным причинам, или просто коллеги хотят поздороваться и узнать, каков статус задач... Пожалуйста, сделайте дверцы. Все-таки это же такие места, в которых можно было спокойно поработать без внешнего вмешательства, но получается совсем не так. Спасибо!","Окей, я понял, мы что-нибудь придумаем
Орынбек, Думан - возьмите в работу",Q3 2024
АХО,"Здравствуйте! Возможно ли на один из этажей поставить льдогенератор, чтобы делать айс латте)","Решили делать лед в специальных контейнерах, который будем разноситься по каждому этажу в золодильники, Добавим трубочки",Q3 2024
Event,"Здравствуйте очень мало информации по дримкоинам. Для всех это только худи. Предлагаю на каждый стол как в кафе поставить тейбл-тенты с ссылкой , так как сотрудники чаще всего говорят об этом другу другу во время обеда. Хотя бы не все столы. Или на кухне плакат стильный сс ссылкой около кофе машины , где будет вся информация. Заранее благодарю ","Окей, сделаем",Q3 2024
Event,"Приветствую. Хотел поблагодарить за все ивенты, которые прошли. Особенно за летние фесты. Организаторы лучшие! Спонсоры Зе Бест))) В связи с тем, что покидаю Каздрим хотел бы предложить чтобы покинувшие каздрим сотрудники имели доступ к ивентам. Дополнительная команда на спортивных мероприятиях (KD.Outsiders или что-то подобное). Доступ к корпоративным вылазкам с какой-нибудь скидкой). Балгабай 

ПС можно ответ на @bassikekz, если Спанч боб пройдет после 09.08.2024","Мы подумаем, идея интересная.
Единственное, те кого вы увололили по негативным моментам - добавлять не будем.
Возможно сделаем так, что бывшим сотрудникам участвовать платно",Q3 2024
Event,"Приветствую, Даурен. Говорят, что тимбилдинг предназначен для знакомства, сплочения и установления дружественных связей между всеми компаниями холдинга. Однако на практике это не всегда так. Когда мы сидели под шатром, к нам подошли руководители одной компании и достаточно дерзко заявили, что наша фирма уже заняла два шатра, и нам нужно освободить этот. Мы сгруппировались и освободили большую часть шатра, но в итоге туда никто не сел. Вопрос к вам, Даурен: нормально ли такое разделение и конкуренция внутри холдинга? Для чего на самом деле проводится общий тимбилдинг? Возможно, стоит отказаться от соревновательного формата, чтобы избежать агрессии между компаниями?","Во первых, это ннеприемлимо, дерзко заявлять о таком. Мы работаем в одной экосистеме, нужно быть более добрым, тем более руководителям.
Внедрим правила, перед следующим тимбилдингом всех проинструктируем",Q3 2024
АХО,"Хотелось бы что бы персонал по уборке был вежливей, и не кричали когда по работе приходиться ходить по коридору. ну или выгонять с кухни дабы помыть полы, когда после работы уставшие хочется чая или просто поесть. 

 В рабочее время очень отвлекает, да, порой жалко нервы тех персонала но и свои как бы тоже🥲

Предлагаю составить какой нибудь график или просто принять тот факт что в РАБОЧЕЕ время сотрудники будут ходит по мытому полу, и всех в кабинете не запрешь. 

А так всем добра, все остальное по офису   и корп культуре вообще супер🙂‍↕️","На 9 этаже такого не замечал, если это на 10 и 11 этаже, сообщите пожалуйста, напишите сразу через QR код, чтоб мы сразу решали этот вопрос",Q3 2024
АХО,Есть необходимость утеплить окна к зимнему периоду. Ранее на скорую руку скотчем заклеили ,"Окей, возьмем на контроль. Орынбек, Думан нужно закрыть этот вопрос",Q3 2024
Даурен,Есть ли возмещение за использование личного ноутбука вместо корпоративного?,"Уточню, отвечу отдельно",Q3 2024
Даурен,"Здравствуйте! Хотела бы поблагодарить за все, что вы делаете для своих сотрудников! Очень чувствуется забота о сотрудниках, спасибо огромное 💓💓💓",Пожалусйта :),Q3 2024
Даурен,"Добрый день! Хочу написать слова благодарности! Спасибо Вам Даурен, за вклад в общество. Мне очень импонирует то как вы организовали компанию! Butterfly Effect это площадка для роста, развития как профессионального так и личностного. Думаю каждый сотрудник согласится со мной, что ваш подход к выстраиванию процесса работы восхищает. Все начинается с на первый взгляд маленьких, но очень значимых вещей, продолжайте в том же духе! А мы будем усердно и с благодарностью работать делая вклад в этот мир, чтобы он становился лучше и безопаснее.",Спасибо! Очень важно услышать обратную связь,Q3 2024
Битрикс,"Просьба как-то автоматизировать работу бота в телеграме с битриксом поскольку постоянно есть какие-то ошибки и ты понимаешь что по сути всё равно возвращаешься к тому, чтобы зайти в битрикс, нажимать кучу кнопок, или приходится писать Ермеку. ","Хорошо, возьмем в изучение, но нужны конркетные кейсы. Отправьте, пожалуйста, Ермеку ",Q3 2024
Event,"На следующий summerfest приобрести больше водяных пистолетов. Мало кому хватило, а некоторые вообще бегали с двумя пистолетами) ","Окей, хорошо, на следующий Summer Fest закупим",Q3 2024
Даурен,"Попросите, пожалуйста, руководителя команды Компра научить своих сотрудников прилично вести себя в обществе. Отвечать на приветствие в коридорах, не срываться на коллег по поводу и без повода, не разводить конфликтов на пустом месте, когда можно корректно и вежливо о чем-то попросить или выразить свое мнение. Очень неприятные ситуации возникают с участием одних и тех же сотрудников - на тимбилдинге, в общих чатах компании, на общих мероприятиях. Из-за этого обо всей команде складывается неприятное впечатление. Спасибо.","Попрошу Айзаду провести работу в компании. И, в целом, к сотрудникам компры - пожалуйста, соблюдайте нормы, мы одна команда",Q3 2024
Даурен,"В компании очень крутые плюшки, спасибо hr отделу и вам CEO) подскажите, если я планирую декретный отпуск то что из плюшек доступно будет? Страховка, фитнес, псих.помощь, тимбилдинги?","Все будет доступно, если вы в декретном отпуске, потому что вы наш сотрудник, который в декрете.",Q3 2024
АХО,"Можно пожалуйста поставить стул в уборных, тем кто берет омовение очень неудобно надевать носки прыгая на одной ноге","У нас на 10 этаже есть команта для омовения, можно пользоваться ей.  Стульчик ставить не будем. Посмотрим соответсвие норм в комнате омовения, отработаем",Q3 2024
АХО,"Большая просьба. Мыть полы после рабочего дня. После 18:30 и 19:00. Либо наоброт рано утром. Это нормальная практика даже в школах/универах. Когда уборщица моет пол в 17:00 это слегка бесполезно, так как после неё мы заходим в кабинет в грязой обуви. И сразу же полы становятся в следах. И моют очень некачественно, просто для вида, от тряпок очень сильно воняет. В кабинете потом невозможно сидеть.","Сделаем замечание
",Q3 2024
Даурен,"Что если сделать обед не 1 час а 45 минут, остальные 15 мин с каждого дня использовать в пятницу в конце рабочего дня, то есть в пятницу уходить на 1час 15мин раньше с работы","Дело не в этом, если вам нужно уйти пораньше, то просто уйдите пораньше, если внутри компании нет других правил. Договоритесь с руководителем",Q3 2024
АХО,"работаю в компании не первый год, очень приятно наблюдать, что у нас развивается корпоративная культура, есть различные способы отвлечься от рутины и отдохнуть, между рабочим процессом, в виде комнаты отдыха, тенниса, ps и библиотеки.
но в дополнение к этому я бы так же хотел предложить добавить что то для тех, у кого хобби - музыка. к примеру фортепиано. я думаю среди 500+ сотрудников компании есть те, кому это по душе и на досуге не помешало бы отвлечься именно таким способом. вероятно есть те, кто хотел бы заниматься/научиться или уже умеет.
ведь это тоже прекрасная форма досуга. ","Окей, возможно в рамках музыкальной комнаты решим этот вопрос",Q3 2024
АХО,"Касательно террасы. Задумка хорошая, но нет концепта. Идеи, расширить площадку для использования пятничного времяпрепровождении разместить лаундж зону, а так же зону для гриля (специальной площадки для использования открытого огня с учетом размещения огнетушителя, может быть газовый гриль, без разжигания огня). Еще одного уровня чуть выше для обозревания города и крутых фотографии. Возможности выводить музыку и делать вечеринки, проводить дни рождения.  ","К сожалению не получится. Это просто будет дополнительное меесто для работы и отдыха, возможно, по вечерам будем проводить проектор - смотреть фильмы.
Гриль ставить не будем, так как рядом жилые дома, в которые будет идти дым",Q3 2024
АХО,Почему нельзя на террасе курить? Было бы идеально с кальяном там поработать. Или за этим только в Алматинский офис? :D,"Пока мы не рискуем курить на крыше, мы сильно за это переживаем, на крыше нельзя курить",Q3 2024
Даурен,"Добрый день, Даурен. Я слышал что в некоторых проектах и компаниях  холдинга 
 заложена сумма на обучение сотрудника. Эта опция является обязательной или добровольной для каждого менеджера? Стоит ли рядовому сотруднику рассчитывать  на помощь со стороны компании или только на свои средства?","Сейчас мы перессматриваем концепт по обучению, хотим проверить гипотезу на 7Generation. Каждая компания сама решает выделять деньги на обучени или нет. Нужно в частном порядке решать этот вопрос",Q3 2024
АХО,"Терраса - крутая, но возможность там курить будет не лишней. Может БЦ пойдет на встречу по этому вопросу? Если все аккуратно делать и использовать не возгораемые материалы. ","Пока мы не рискуем курить на крыше, мы сильно за это переживаем, на крыше нельзя курить",Q3 2024
Даурен,"Почему на 10 этаже никто не здоровается или хотя бы не отвечает на приветствие? Даже офис-менеджер не здоровается в ответ (дело было не среди дня в спешке, а в 10 утра). Кажется, такое противоречит нашей корпоративной культуре.","Конечно, это противоречит. 10 этаж - 2 замечание. Здоровайтесь - это же классно!) Офис менеджер, просьба, обратить внимание на этот факт. Как день начнется - так он и продолжится",Q3 2024
Даурен,"Можно ли рассмотреть предложение по добавлению курса по Китайскому языку?) Данный язык имеет очень большой спрос, хотелось бы в такой ходить регулярно как ребята ходят на английский)) Рассмотрите пожалуйста, есть ли и у других сотрудников интерес к Китайскому) Спасибо ❤️",Пока мы не готовы с обучением китайского языка.,Q3 2024
Кадры,Скидка или абонемент на life fitness для сотрудников ,"Переговорим. Попрошу Гульмиру Купешеву, чтоб она договорилась с Life Fitness",Q3 2024
Кадры,"Необходимо рассмотреть возможность при выходе в отпуск материальная помощь в размере 0.5 - 1 от зарплаты. Это может выкупить билеты для смены картины, восстановиться и вернуться на работу свежим и яркими глазами.

Также рассмотреть возможность каждые 2, 4, 6, 8 лет работы в компании надбавку за стаж\выслугу лет в размере 50% от зарплаты. Это хорошо повлияет на стабильность ресурсов, уменьшит текучесть кадров и сделает нас более лучшей компанией","У нас есть отпускные, по законну предусмотренно. Насчет надбавки, каждый год примерно 80% сотрудникам поднимается зарплата.
За выслугу лет зарплату поднимать не будем",Q3 2024
Даурен,"Это правда, что для того, что-бы продвинуться внутри компании по карьерной лесенке нужно хорошо играть в настольный теннис? А вы Даурен хорошо играете?","Давно не играл. А то, что можно продвигаться по карьерной лестнице - наверное шутка)",Q3 2024
АХО,Когда уже в офисе перестанет капать с потолка? Каждый месяц после починки начинается опять...,Я тоже крайне недоволен. Давайте в следующий дождь чекнем. У Орынбека на контроле,Q3 2024
Даурен,"После падения биржи, особенно японской, как думаете будет экономический кризис? США объявит уже о своей рецессии или зассут перед выборами? ","Я понимаю, что падение любой биржы повлият на экономику страны, а возможно и всего мира. Мое мненине не поменяется до выборов",Q3 2024
Даурен,Правда ли что скоро у нас появится 8 группа компаний? ,Навряд ли скоро появится,Q3 2024
Даурен,Можно перенести игровую с 9-го этажа? Мы стараемся здесь работать...,Нужно понять. кому мы мешаем. Решим вопрос. Но на других этажах нет мест для игровой,Q3 2024
Даурен,Кто победит на выборах США по-вашему мнению и как это отразится на Мире и на нас? ,"Я думаю, что Трамп победит, он мне импонирует",Q3 2024
Даурен,"В прошлом году были замечательные курсы от EXPHUB, к сожалению не успела записаться. В этом году они продолжаться, будут ли новые программы? ","Сейчас мы все тестировать будем через 7G, техорда - не подошел подход",Q3 2024
Даурен,"Подскажите, что с BFE.University?
","Будет свой университет, будет свое обучение",Q3 2024
Даурен,"Давайте четко обозначим правила по переработкам и day off. Когда можно брать, как компенсируется, кто согласовывает. ",Комании разные - договоренности разные. Каждая компания будет ставить свои правила,Q3 2024
Даурен,"Что нужно делать, чтобы тоже можно было летать в командировки в Чехию, Дубай, Сингапур?","Работать с компаниями, которые летают туда - Kazdream, MSSP, Keden, Aimap. А внутри компании - хорошо работать. Подойдите к своему руководителю и скажите, что хотите полелететь",Q3 2024
Даурен,"Простите, но лето... Жара... Ежедневный душ 👍, свежая одежда 👍 . Не забываем ✌️","Окей, хорошо",Q3 2024
Даурен,"Даурен, здравствуйте, почему у нас в компании постоянно все встречи переносятся? Даже Спанч-бобы тоже часто переносятся. Может на корпоративном уровне ввести занятия по тайм-менеджменту? ","Этот Спанч Боб не переносили)
До этого да, были постоянные командировки. Если Спан Боб переносится, то это сугубо из-за того, что у меня перегруз

По тайм-менеджменту мы подумаем",Q3 2024
Даурен,"Какие топ-3 авиалинии по-вашему мнению?
","Air Astana 
Qatar Airways
British Airways",Q3 2024
Даурен,Через сколько лет 7G станет единорогом?,5 лет,Q3 2024
