Категория,Вопросы,Ответ,Квартал
СБ,"Можно что-то сделать с тем что в новом офисе курят и насфаем закидывается? Курят точно где не ясно только запах чувствуем в своем кабинете, а насфай переодический либо в туалете либо в раковине лежит ","Курить запрещено в офисе, будем штрафовать. Штраф будет от 50тыс и выше, зарплату будем удерживать.
Курите не в рамках офса, место для курения в офисе нет. 
Орынбек и Думан, посмотрите можно ли сделать где-нибудь место для курения в офисе, с вытяжкой.Возможно сделаем даже общественную доску позора",Q1 2024
СБ,"Добрый день Даурен ! Запрещено ли курить в офисе ? Потому что 9-10 этажи курят в кабинетах и на балконах и сильно тянет на 11 этаж ,невозможно работать! У нас же компания за зож почему тогда разрешено курить ","Курить запрещено в офисе, будем штрафовать. Штраф будет от 50тыс и выше, зарплату будем удерживать.
Курите не в рамках офса, место для курения в офисе нет. 
Орынбек и Думан, посмотрите можно ли сделать где-нибудь место для курения в офисе, с вытяжкой.Возможно сделаем даже общественную доску позора",Q1 2024
АХО,"Пожалуйста, создайте условия для омовения и для всех кто умывается в раковине. Религия и чистоплотность это важно, да, но после умывания много воды на полу и вокруг раковины и никто об этом не думает. Хотя бы тряпки какие-нибудь, чтобы вытирали пол и места вокруг раковины за собой. Я ни в коем случае не хочу осудить или запретить это делать, но об окружающих нужно думать.","В рамках предыдущих вопросов, обсудим, как правильно это сделать. Возможно, где душевые кабины.",Q1 2024
АХО,"Прошу отрегулировать график мытья полов с тех.персоналом и проводить влажную уборку во вне рабочее время. Это очень неудобно и дискомфортно как для тех.персонала, так и для работников. ","Окей, услышали. Возьмем в работу",Q1 2024
Даурен,"здравствуйте! когда у нас будут в кдсс карты скудд для фиксирования опоздании? 
почему один проект имеет право опаздывать каждый день но уходить во время, а другой  проект несмеренно работает с 9 или ровно с 10. 
Для справедливости: сотрудник,  кто каждый день опоздает на 20 минут, должен отработать 8 часов или минус оклад за один рабочий день. ","Каждая команда сама решает, как им приходить. Если одна команда приходит не вовремя, но команда эффективна, то ок. Компании сами принимают решения. Регулировать я не буду",Q1 2024
АХО,Двери в Сайлент боксы ,"Окей, услышали, учтем. В рамках дизайна пока будем сами тестировать какие надписи делать, плакаты и тд. Потом дизайнер сведет все в общую концепцию.",Q1 2024
АХО,"Растения в кабинеты и что-то, что создаст уют, но не отвлекает от работы. Офисы серые и не уютные совсем. Только коридор более менее живой, и то, только на рецепшене. ","Все будет, зелень, дизайн. Все будет с общей концепцией",Q1 2024
Event,"Здравствуйте, Даурен! Прошу разрешить использовать чеки на возмещение по Kazdream Health без ограничения сроков или ограничить максимально возможным сроком. Думаю
это бич многих, так как мы не можем знать, когда нам может понадобится возмещение. Отдельная благодарность за эту плюшку!  ","Там есть ограничения. Вопрос не совсем понятный, прошу автора написать в личку, что он имел ввиду.",Q1 2024
Даурен,"Даурен, проясните, пожалуйста, позицию компании в отношении удаленной работы. Можно ли работать удаленно, если это комфортнее для сотрудника и нет производственной необходимости находиться в офисе каждый день с 10 до 19? У менеджмента замечена нездоровая тенденция выгонять всю команду в офис на весь день просто так, лишь бы было. Что делать тем, кто эффективнее и продуктивнее выполняет свои задачи из дома? Или работа в офисе 5/2 по 8 часов - это официальная позиция холдинга, и удаленка запрещена?","Мы не регулируем этот вопрос, я за эффективность. На решение каждой компании/команды.",Q1 2024
Даурен,"Здравствуйте, Даурен! Спасибо за ваше время и внимание!
В мире активно экспериментируют с четырех дневной рабочей неделей (с сохранением зп и без увеличения часовой нагрузки в день). Будут ли в будущем внедряться в Kazdream подобные практики?","Если вы будете эффективнее, и за 4 дня будете выполнять всю работу, я за. ",Q1 2024
Даурен,"Вопрос, входим ли мы в AstanaHub? Просто там есть плюшки по налогам, думаю стоит рассмотреть это","У нас 8 компаний с 11 проектами входят в Астана хаб:
CodeCraft, Zakupki.kz, Kompra, Onecode, Gekata, Beine, Кибернадзор, Контр, АИК, LBase, Meta Moving уже входят.
",Q1 2024
Даурен,"Пожалуйста!!!!! Сортируйте вопросы в порядке значимости. То есть в первой половине спанчбоба важные: которые касаются всех, которые поднимают важные вопросы и т.д. 
А потом все остальные, по типу «а почему какой- то Талгат  ушел» или «Как Даурен относится к лгбт». Дайте возможность нам первую часть прослушать и проникнуться ситуацией, а вторую просто слушать на фоне. ","Мы только группируем вопросы, похожие между собой. Я считаю, что все вопросы важные. ",Q1 2024
Даурен,Сколько нужно съесть бизнес ланчей чтобы стать бизнесменом?,"Нисколько, чтобы открыть бизнес, не нужно ходить на бизнес ланчи. Просто just do it",Q1 2024
Даурен,"Всем саламский привет . 

Оскар награждения супер спорным получилось. 80% всех награждений не заслуженные, много топовых с хорошими достижениями не наградили. 

Предлагаю голосованием на в компанию и на команды такой выбор делать, плюс число их уменьшить и дать им слово после награждения. 

С уважением, Негодующий Аноним Награжденный! ",Учтем это.,Q1 2024
Даурен,Огромные проблемы с менеджментом в компании. ,"Я считаю тут надо говорить более точно. Я за прозрачность, за открытость. И тогда мы сможем принимать решения.",Q1 2024
Даурен,"Видел у друга, что они пользуются приложением SLACK для работы. Показалось сильно удобнее, чем телеграм. Думаю стоит попробовать. ",Телеграм это общий канал коммуникаций. Хотите отдельно для себя пользуйтесь SLACK,Q1 2024
Даурен,"Мусин на digital Almaty говорил, что сейчас создают аналог ChatGPT для казахского. Это наш speechlab делает? ","Нет, СПич лаб этого не делает",Q1 2024
Даурен,"Почему ежемесячный спанчбоб не всегда даже в квартал проходит?) 
","В квартал точно проходит, бывает, что мы переносим по разным причинам",Q1 2024
Даурен,"Специально ли группа людей, которая выбирала новый офис, в итоге его выбрала рядом с Хайвиллем и банкоматами?","Нет, он вообще никак этим не был выбран. Офис выбирался очень долго и тщательно",Q1 2024
Даурен,"как думаете, может нам нужен ещё один спанчбоб для каждой компании со своим директором? могли бы направлять им операционные вопросы, которые они решают на своем уровне",Был такой вопрос. даже директора заходил с таким предложением. Но я счиатю. что спанч боб должен быть один. Это наша традиция,Q1 2024
АХО,"Можно стоянку для велосипеда в парковке сделать? На улице перед БЦ оставлять рискованно, хоть и антиугонка с прочной цепью","Поддерживаю ребят, но в паркинге точно запрещают. Думан и Орынбек рассмотрят разные варианты.
Как вариант в соседнем здании есть паркинг, можно будет оставлять там, рассмотрим",Q2 2024
Event,"Почему перестали снимать KazdreamFaces? Последний раз был рыжебородый красвчик год назад и все, больше никого не было.   ",Вернем Faces,Q2 2024
АХО,"Предлагаю на лето мини  морозильник, в котором можно замораживать лед. И делать эспрессо-тоник самостоятельно ","Предлагаю мороженное, закупим морозильники на каждый этаж",Q2 2024
HR,"Есть ли вероятность, что будет корпоративный психолог? ","Некоторые вопросы можно решить через HR. Был психолог. В целом идея мне нравится, но я против, чтоб психолог использовался в личных целях. Изучим этот вопрос, возможно будет онлайн психолог. Возьмем на этот вопрос 3 недели. Если у вас есть контакты хороших психологов, отправляйте в бот.",Q2 2024
Даурен,"Даурен, хочу поднять очень большую проблему нашей компании. Не воспримите мои негодования за оскорбления, они ими не являются. 

По-моему и не только моему мнению, в нашей компании есть катастрофические проблемы с PR и как мы позиционируемся для потенциальных кандидатов на рынке. 
Любая успешная компания появляется и живет благодаря талалантливым, или гениальным, или безумно горящим специалистам. 
Как правило, такие люди являются нон-конформистами. Которые зачастую воспринимают нашу компанию как аффилированную с кнб. Который выглядит в обществе,  как коррупционная структура, которая мародерит страну и бизнесы, следят за гражданами, прослушивает их, ущемляет за либеральные политические взгляды.
Из-за такого мнения в нашу сторону, на нас не смотрят сильные кандидаты, и если посмотрят, то это будет счастливым исключением для нас. 
У нас в компании раньше был PR директор, который занимался улучшением нашего имиджа. Почему его нет сейчас? Почему никак эта ситуация не улучшается в последние годы? Почему улучшение PR холдинга не является высочайшим приоритетом? 

Совсем уважением, данный текст не несет в себе оскорблений, спасибо! ","Очень благодарен человеу, который это написал. PR директор у нас была, когда у нас был холдинг, сейчас у нас эко-система и у каждой группы компании есть свой PR

Возьму на особый контроль, PR BFE",Q2 2024
АХО,Здравствуйте. На 10 этаже очень не хватает принтера. Приходится тратить время и искать по этажам. Можно ли поставить его и 10 этаже?,"Окей, поставим. Думан купит принтер и поставить. ",Q2 2024
АХО,"Цены дорогие в холодильниках на 10 этаже и 11 этаже. В сэндвиче Хлеб 2 тонких огурчика 2 тонких докторских колбасы и не свежий лист салат. Хлеб обычный. Это стоит 1080 тг, это же очень дорого! 
На 11 этаже маленький тортик 1200 тг. который ты съел или не съел не понял, еще стоят по 3 или 4 дня не свежие, не забирают поставщики не свежие свои пироги и торты. Никто у нас не контролирует цены, никто не контролирует чтобы забирали не свежее и приносили свежее,  А МЫ НЕ успеваем бегать покупать в ближайший магазин так как он далеко, из за встреч с заказчиками и дейли, магазинов рядом нет. Скажите пожалуйста поставщикам чтобы готовили нормально если ставят такие цены, пусть делают вкусно и ставят через день свежее, что на выходных осталось пусть забирают в понедельник. Ощущение что нас держат за лохов, типа айти богатые пусть едят фигню и за большие деньги. ","Согласен. Будем наводить порядок, чтобы ассортимент был нормальный и цены адекватные. Если есть поставщик - предлагайте",Q2 2024
Битрикс,Почему все сотрудники не указывают в Телеграме фамилию и имя? К примеру мне нужен Иванов Иван приходится искать его долго т.к. в Телеграме инкогнито или просто две первые буквы ФИО указаны ,"В битрексе есть информация, там ссылка на телеграмм.
Ген. директора в чате отчитаются по ссылке на телеграмм/номер, касательно достовернности данных.",Q2 2024
АХО,"Здравствуйте, новый офис -- пушка и будет ещё лучше. Я Знаю, что сейчас игровая ещё не совсем готова, но есть предложение обновить столы для настольного тенниса, текущие уже не совсем удовлетворяют профессионализму наших игроков, а также обновить ракетки и возможно добавить помещение для игры на других этажах, тк желающих в обеденное время очень много","Возможно будем выставлять на тех этаже столы, такой вариант. Я за, чтобы обновить столы. Ракеток должно быть много, они должны обновляться. ",Q2 2024
АХО,"Давайте сделаем отдельную кабинку для людей, кто курит Iqos, одноразки. Т.к не всем нравится запах никотина в кабинете или те кто в завязке . ","Запрещено курить айкос и одноразки курить в кабинете. Призываю тех - кто курит в кабинете - не курить. 
Изучим вопрос выделения места для курения на балконе.",Q2 2024
HR,"Добрый день, предлагаю поднять компенсацию фитнеса на 5000 )) ","Вопрос финансовый, нужно посчитать, возьмем на проработку",Q2 2024
Академия ,Доброго дня! Просьба возобновить занятия по казахскому языку. В целом спасибо за возможность изучать языки на рабочем месте. ,"Проголосуем в чате, если мы получим заявку более чем 20-ти сотрудников на обучение, тогда мы заново запустим. Менее 20-ти мы не будем этого делать.",Q2 2024
Event,Есть нужда в комнате матери и ребёнка 😊,"Пока нет, но проведем опрос",Q2 2024
Event,"Добрый день, Даурен!

Предлагаю открыть в офисе медицинский кабинет с терапевтом. Это позволит сотрудникам получать направления к специалистам, оформлять больничные, получать первую медицинскую помощь и ставить системы, не тратя время на поездки в больницу. Врач может работать 2 часа в день, что будет достаточно.","Давайте спросим в чате всех, проведем опрос.",Q2 2024
АХО,"Как на счет выдачи завтраков тем кто приходит с 08.30 и до 10.00, так как мы не успеваем завтракать дома. Хотя бы сухой завтрак и хлеб (поставить тостеры) хлеб тостерный, масло и какие-то джемы. В малых кол-х чисто для тех кто утром дома не поел и быстро пришел утром в офис. ","Я за и поддерживаю. Будет свежий хлеб, тостеры, джем. Будем мотивировать приходить пораньше в офис)",Q2 2024
Event,"Возможно ли сделать оплату за такси до дома если ты задержался на работе? Не по своему желанию, а если надо так как сказали руководители. Например если ты уходишь в 22.00 или в 23.00. ","Да, я согласен. По механике проработаем
Я за то, чтоб дать всем доступ такси, но по определенным правилам.",Q2 2024
Event,"Привет, Даурен. Хочу предложить не повторять одну и ту же информацию в чате. У нас есть канал REBOOT 2024, KD LIVE NEWS и чат KD OFFICIAL. Почему бы не размещать информацию о ребуте исключительно в специальном канале? Зачем отправлять ее и в канал новостей, и в официальный чат? Лично меня это отвлекает, и из-за постоянных повторов становится сложно отслеживать важные моменты. Можем ли мы сфокусироваться на едином источнике информации?",Попрошу не дублировать в официальные чаты.,Q2 2024
АХО,"Добрый день! Не секрет , что в новом офисе возникли проблемы с доступом к розеткам и история с удлинителями. Предлагаю сделать встроенные в столешницу розетки. Например 2-3 розетки+RJ45+USB ","Окей, давайте сделаем",Q2 2024
Event,"Панельные сессии получилось очень крутыми на ребуте. Не думали ли вы проводить такой формат с более частой периодичностью. Например, каждый третий ребут, приглашать директоров.","Сделаем подкаст. Я приглашу директоров, соберем команду такую",Q2 2024
Даурен,"Телеграмм ужасный выбор корпоративного мессенджера, поголовно лучшие компании используют другие. Давайте перейдем, например, на slack. Работал много, где, лучше slack ничего не видел.","Давайте изучим этот вопрос. Ген. директора соберите информацию, на директорате во вторник примем решение",Q2 2024
АХО,"Волнует вопрос терморегулятора в офисе. Включат ли его в вообще? До сих пор кому-то холодно,кому то жарко. Открыть-закрыть окно не помогает.","Отрабатывают, будем держать на особом контроле",Q2 2024
